mysql> use FSD_tasks
Database changed
mysql> create table course(
    -> course_id int primary key,
    -> course_name varchar(50),
    -> fee decimal (10,2)check (fee>0)
    -> );
Query OK, 0 rows affected (0.10 sec)

mysql> create table student (
    ->     student_id int primary key,
    ->     name varchar(50),
    ->     email varchar(100) unique,
    ->     dob date,
    ->     course_id int,
    ->     marks int check (marks between 0 and 100),
    ->     foreign key (course_id) references course(course_id)
    -> );
Query OK, 0 rows affected (0.09 sec)

mysql> insert into course (course_id, course_name, fee) values(101, 'Java Programming', 12000),(102, 'Web Development', 10000),(103, 'Data Structures', 11000),(104, 'Database Systems', 9500),(105, 'Python Programming', 11500);
Query OK, 5 rows affected (0.04 sec)
Records: 5  Duplicates: 0  Warnings: 0

mysql> select * from course;
+-----------+--------------------+----------+
| course_id | course_name        | fee      |
+-----------+--------------------+----------+
|       101 | Java Programming   | 12000.00 |
|       102 | Web Development    | 10000.00 |
|       103 | Data Structures    | 11000.00 |
|       104 | Database Systems   |  9500.00 |
|       105 | Python Programming | 11500.00 |
+-----------+--------------------+----------+
5 rows in set (0.01 sec)

mysql> insert into student (student_id, name, email, dob, course_id, marks) values
    -> (1, 'anil', 'anil.k@example.com', '2002-07-15', 101, 85),
    -> (2, 'sneha', 'sneha.r@example.com', '2001-11-22', 102, 78),
    -> (3, 'vikram', 'vikram.s@example.com', '2003-01-30', 103, 91),
    -> (4, 'divya', 'divya.p@example.com', '2002-04-18', 101, 88),
    -> (5, 'ravi ', 'ravi.t@example.com', '2001-09-05', 104, 69);
Query OK, 5 rows affected (0.04 sec)
Records: 5  Duplicates: 0  Warnings: 0

mysql> select * from student;
+------------+--------+----------------------+------------+-----------+-------+
| student_id | name   | email                | dob        | course_id | marks |
+------------+--------+----------------------+------------+-----------+-------+
|          1 | anil   | anil.k@example.com   | 2002-07-15 |       101 |    85 |
|          2 | sneha  | sneha.r@example.com  | 2001-11-22 |       102 |    78 |
|          3 | vikram | vikram.s@example.com | 2003-01-30 |       103 |    91 |
|          4 | divya  | divya.p@example.com  | 2002-04-18 |       101 |    88 |
|          5 | ravi   | ravi.t@example.com   | 2001-09-05 |       104 |    69 |
+------------+--------+----------------------+------------+-----------+-------+
5 rows in set (0.00 sec)

mysql> update course set fee= fee*1.12;
Query OK, 5 rows affected (0.02 sec)
Rows matched: 5  Changed: 5  Warnings: 0

mysql> select * from course;
+-----------+--------------------+----------+
| course_id | course_name        | fee      |
+-----------+--------------------+----------+
|       101 | Java Programming   | 13440.00 |
|       102 | Web Development    | 11200.00 |
|       103 | Data Structures    | 12320.00 |
|       104 | Database Systems   | 10640.00 |
|       105 | Python Programming | 12880.00 |
+-----------+--------------------+----------+
5 rows in set (0.00 sec)

mysql> create table books (
    -> book_id int primary key,
    -> title varchar(100),
    -> author varchar(100),
    -> price decimal(8,2)
    -> );
Query OK, 0 rows affected (0.12 sec)

mysql> insert into books values
    -> (1, 'the great gatsby', 'f. scott fitzgerald', 399.00),
    -> (2, 'to kill a mockingbird', 'harper lee', 349.00),
    -> (3, '1984', 'george orwell', 299.00),
    -> (4, 'pride and prejudice', 'jane austen', 279.00),
    -> (5, 'the catcher in the rye', 'j.d. salinger', 319.00);
Query OK, 5 rows affected (0.01 sec)
Records: 5  Duplicates: 0  Warnings: 0

mysql> create table members (
    -> member_id int primary key,
    -> name varchar(50),
    -> email varchar(100) unique
    -> );
Query OK, 0 rows affected (0.07 sec)

mysql> INSERT INTO members (id, name, email) VALUES
    -> (5, 'Zoya Khan', 'zoya.k@example.com'),
    -> (4, 'Ravi Patel', 'ravi.p@example.com'),
    -> (3, 'Neha Joshi', 'neha.j@example.com'),
    -> (2, 'Meera Sharma', 'meera.s@example.com'),
    -> (1, 'Arun Kumar', 'arun.k@example.com');
ERROR 1054 (42S22): Unknown column 'id' in 'field list'
mysql> INSERT INTO members (member_id, name, email) VALUES
    -> (5, 'Zoya Khan', 'zoya.k@example.com'),
    -> (4, 'Ravi Patel', 'ravi.p@example.com'),
    -> (3, 'Neha Joshi', 'neha.j@example.com'),
    -> (2, 'Meera Sharma', 'meera.s@example.com'),
    -> (1, 'Arun Kumar', 'arun.k@example.com');
Query OK, 5 rows affected (0.01 sec)
Records: 5  Duplicates: 0  Warnings: 0

mysql> select * from books;
+---------+------------------------+---------------------+--------+
| book_id | title                  | author              | price  |
+---------+------------------------+---------------------+--------+
|       1 | the great gatsby       | f. scott fitzgerald | 399.00 |
|       2 | to kill a mockingbird  | harper lee          | 349.00 |
|       3 | 1984                   | george orwell       | 299.00 |
|       4 | pride and prejudice    | jane austen         | 279.00 |
|       5 | the catcher in the rye | j.d. salinger       | 319.00 |
+---------+------------------------+---------------------+--------+
5 rows in set (0.00 sec)

mysql> select * from members;
+-----------+--------------+---------------------+
| member_id | name         | email               |
+-----------+--------------+---------------------+
|         1 | Arun Kumar   | arun.k@example.com  |
|         2 | Meera Sharma | meera.s@example.com |
|         3 | Neha Joshi   | neha.j@example.com  |
|         4 | Ravi Patel   | ravi.p@example.com  |
|         5 | Zoya Khan    | zoya.k@example.com  |
+-----------+--------------+---------------------+
5 rows in set (0.00 sec)

mysql> create table borrow_records (
    -> borrow_id int primary key,
    -> member_id int,
    -> book_id int,
    -> borrowed_on date,
    -> returned_on date,
    -> foreign key (member_id) references members(member_id),
    -> foreign key (book_id) references books(book_id)
    -> );
Query OK, 0 rows affected (0.13 sec)

mysql> insert into borrow_records (borrow_id, member_id, book_id, borrowed_on, returned_on) values
    -> (1, 1, 101, '2025-06-01', '2025-06-10'),
    -> (2, 2, 102, '2025-06-05', null),
    -> (3, 1, 103, '2025-06-08', '2025-06-15');
ERROR 1452 (23000): Cannot add or update a child row: a foreign key constraint fails (`fsd_tasks`.`borrow_records`, CONSTRAINT `borrow_records_ibfk_2` FOREIGN KEY (`book_id`) REFERENCES `books` (`book_id`))
mysql> 
mysql> insert into borrow_records (borrow_id, member_id, book_id, borrowed_on, returned_on) values
    -> (1, 1, 101, '2025-06-01', '2025-06-10'),
    -> (2, 2, 102, '2025-06-05', null),
    -> (3, 1, 103, '2025-06-08', '2025-06-15');
ERROR 1452 (23000): Cannot add or update a child row: a foreign key constraint fails (`fsd_tasks`.`borrow_records`, CONSTRAINT `borrow_records_ibfk_2` FOREIGN KEY (`book_id`) REFERENCES `books` (`book_id`))
mysql> insert into borrow_records (borrow_id, member_id, book_id, borrowed_on, returned_on) values
    -> (1, 1, 101, '2025-06-01', '2025-06-10'),
    -> (2, 2, 102, '2025-06-05', null),
    -> (3, 1, 103, '2025-06-08', '2025-06-15');
ERROR 1452 (23000): Cannot add or update a child row: a foreign key constraint fails (`fsd_tasks`.`borrow_records`, CONSTRAINT `borrow_records_ibfk_2` FOREIGN KEY (`book_id`) REFERENCES `books` (`book_id`))
mysql> insert into borrow_records (borrow_id, member_id, book_id, borrowed_on, returned_on) values
    -> (1, 1, 1, '2025-06-01', '2025-06-10'),
    -> (2, 2, 2, '2025-06-05', null),
    -> (3, 1, 3, '2025-06-08', '2025-06-15');
Query OK, 3 rows affected (0.01 sec)
Records: 3  Duplicates: 0  Warnings: 0

mysql> select * from borrow_records;
+-----------+-----------+---------+-------------+-------------+
| borrow_id | member_id | book_id | borrowed_on | returned_on |
+-----------+-----------+---------+-------------+-------------+
|         1 |         1 |       1 | 2025-06-01  | 2025-06-10  |
|         2 |         2 |       2 | 2025-06-05  | NULL        |
|         3 |         1 |       3 | 2025-06-08  | 2025-06-15  |
+-----------+-----------+---------+-------------+-------------+
3 rows in set (0.00 sec)

mysql> create table department (
    -> department_id int primary key,
    -> department_name varchar(50),
    -> location varchar(50)
    -> );
Query OK, 0 rows affected (0.08 sec)

mysql> insert into department (department_id, department_name, location) values
    -> (01, 'Finance', 'Chennai'),
    -> (02, 'IT', 'Bangalore'),
    -> (03, 'Marketing', 'Mumbai'),
    -> (04, 'HR', 'Delhi'),
    -> (05, 'Sales', 'Hyderabad');
Query OK, 5 rows affected (0.01 sec)
Records: 5  Duplicates: 0  Warnings: 0

mysql> select * from department;
+---------------+-----------------+-----------+
| department_id | department_name | location  |
+---------------+-----------------+-----------+
|             1 | Finance         | Chennai   |
|             2 | IT              | Bangalore |
|             3 | Marketing       | Mumbai    |
|             4 | HR              | Delhi     |
|             5 | Sales           | Hyderabad |
+---------------+-----------------+-----------+
5 rows in set (0.00 sec)

mysql> create table employee (
    ->     emp_id int primary key,
    ->     ename varchar(50),
    ->     job varchar(50),
    ->     salary decimal(10,2),
    ->     hiredate date,
    ->     department_id int,
    ->     foreign key (department_id) references department(department_id)
    -> );
Query OK, 0 rows affected (0.07 sec)

mysql> insert into employee (employee_id, name, position, salary, birth_date, department_id) VALUES
    -> (106, 'Nisha', 'Salesman', 2500, '1983-05-30', 1),
    -> (105, 'Suman', 'Manager', 6200, '1980-11-20', 2),
    -> (104, 'Anu', 'Salesman', 2100, '1981-01-10', 1),
    -> (103, 'Rekha', 'HR', 3000, '1982-07-11', 2),
    -> (102, 'Manoj', 'Salesman', 2200, '1981-06-01', 1),
    -> (101, 'Ravi', 'Manager', 6000, '1981-03-20', 1);
ERROR 1054 (42S22): Unknown column 'employee_id' in 'field list'
mysql> INSERT INTO employee (emp_id, ename, job, salary, hiredate, department_id) VALUES
    -> (101, 'Ravi', 'Manager', 6000.00, '1981-03-20', 1),
    -> (102, 'Manoj', 'Salesman', 2200.00, '1981-06-01', 1),
    -> (103, 'Rekha', 'HR', 3000.00, '1982-07-11', 2),
    -> (104, 'Anu', 'Salesman', 2100.00, '1981-01-10', 1);
Query OK, 4 rows affected (0.01 sec)
Records: 4  Duplicates: 0  Warnings: 0

mysql> select * from employee;
+--------+-------+----------+---------+------------+---------------+
| emp_id | ename | job      | salary  | hiredate   | department_id |
+--------+-------+----------+---------+------------+---------------+
|    101 | Ravi  | Manager  | 6000.00 | 1981-03-20 |             1 |
|    102 | Manoj | Salesman | 2200.00 | 1981-06-01 |             1 |
|    103 | Rekha | HR       | 3000.00 | 1982-07-11 |             2 |
|    104 | Anu   | Salesman | 2100.00 | 1981-01-10 |             1 |
+--------+-------+----------+---------+------------+---------------+
4 rows in set (0.00 sec)

mysql> insert into employee (emp_id, ename, job, salary, hiredate, department_id) values
    -> (105, 'Sunil', 'Developer', 5500.00, '1983-04-12', 3),
    -> (106, 'Priya', 'Analyst', 4800.00, '1984-11-23', 2);
Query OK, 2 rows affected (0.01 sec)
Records: 2  Duplicates: 0  Warnings: 0

mysql> select * from employee;
+--------+-------+-----------+---------+------------+---------------+
| emp_id | ename | job       | salary  | hiredate   | department_id |
+--------+-------+-----------+---------+------------+---------------+
|    101 | Ravi  | Manager   | 6000.00 | 1981-03-20 |             1 |
|    102 | Manoj | Salesman  | 2200.00 | 1981-06-01 |             1 |
|    103 | Rekha | HR        | 3000.00 | 1982-07-11 |             2 |
|    104 | Anu   | Salesman  | 2100.00 | 1981-01-10 |             1 |
|    105 | Sunil | Developer | 5500.00 | 1983-04-12 |             3 |
|    106 | Priya | Analyst   | 4800.00 | 1984-11-23 |             2 |
+--------+-------+-----------+---------+------------+---------------+
6 rows in set (0.00 sec)

mysql> commit;
Query OK, 0 rows affected (0.00 sec)

mysql> select * from employee;
+--------+-------+-----------+---------+------------+---------------+
| emp_id | ename | job       | salary  | hiredate   | department_id |
+--------+-------+-----------+---------+------------+---------------+
|    101 | Ravi  | Manager   | 6000.00 | 1981-03-20 |             1 |
|    102 | Manoj | Salesman  | 2200.00 | 1981-06-01 |             1 |
|    103 | Rekha | HR        | 3000.00 | 1982-07-11 |             2 |
|    104 | Anu   | Salesman  | 2100.00 | 1981-01-10 |             1 |
|    105 | Sunil | Developer | 5500.00 | 1983-04-12 |             3 |
|    106 | Priya | Analyst   | 4800.00 | 1984-11-23 |             2 |
+--------+-------+-----------+---------+------------+---------------+
6 rows in set (0.00 sec)

mysql> commit;
Query OK, 0 rows affected (0.00 sec)

mysql> Terminal close -- exit!
